28,books#volume,JmydDwAAQBAJ,DJOIqueOuKI,https://www.googleapis.com/books/v1/volumes/JmydDwAAQBAJ,Applied Data Science,Lessons Learned for the Data-Driven Business,"['Martin Braschler', 'Thilo Stadelmann', 'Kurt Stockinger']",Springer,2019-06-13,"This book has two main goals: to define data science through the work of data scientists and their results, namely data products, while simultaneously providing the reader with relevant lessons learned from applied data science projects at the intersection of academia and industry. As such, it is not a replacement for a classical textbook (i.e., it does not elaborate on fundamentals of methods and principles described elsewhere), but systematically highlights the connection between theory, on the one hand, and its application in specific use cases, on the other. With these goals in mind, the book is divided into three parts: Part I pays tribute to the interdisciplinary nature of data science and provides a common understanding of data science terminology for readers with different backgrounds. These six chapters are geared towards drawing a consistent picture of data science and were predominantly written by the editors themselves. Part II then broadens the spectrum by presenting views and insights from diverse authors – some from academia and some from industry, ranging from financial to health and from manufacturing to e-commerce. Each of these chapters describes a fundamental principle, method or tool in data science by analyzing specific use cases and drawing concrete conclusions from them. The case studies presented, and the methods and tools applied, represent the nuts and bolts of data science. Finally, Part III was again written from the perspective of the editors and summarizes the lessons learned that have been distilled from the case studies in Part II. The section can be viewed as a meta-study on data science across a broad range of domains, viewpoints and fields. Moreover, it provides answers to the question of what the mission-critical factors for success in different data science undertakings are. The book targets professionals as well as students of data science:first, practicing data scientists in industry and academia who want to broaden their scope and expand their knowledge by drawing on the authors’ combined experience. Second, decision makers in businesses who face the challenge of creating or implementing a data-driven strategy and who want to learn from success stories spanning a range of industries. Third, students of data science who want to understand both the theoretical and practical aspects of data science, vetted by real-world case studies at the intersection of academia and industry.","[{'type': 'ISBN_13', 'identifier': '9783030118211'}, {'type': 'ISBN_10', 'identifier': '3030118215'}]",False,True,464,BOOK,['Computers'],NOT_MATURE,False,0.1.2.0.preview.1,False,False,http://books.google.com/books/content?id=JmydDwAAQBAJ&printsec=frontcover&img=1&zoom=5&edge=curl&source=gbs_api,http://books.google.com/books/content?id=JmydDwAAQBAJ&printsec=frontcover&img=1&zoom=1&edge=curl&source=gbs_api,en,http://books.google.fr/books?id=JmydDwAAQBAJ&pg=PR1&dq=data+science&hl=&as_brr=6&cd=29&source=gbs_api,https://play.google.com/store/books/details?id=JmydDwAAQBAJ&source=gbs_api,https://play.google.com/store/books/details?id=JmydDwAAQBAJ,FR,FOR_SALE,True,158.24,EUR,110.77,EUR,https://play.google.com/store/books/details?id=JmydDwAAQBAJ&rdid=book-JmydDwAAQBAJ&rdot=1&source=gbs_api,"[{'finskyOfferType': 1, 'listPrice': {'amountInMicros': 158240000, 'currencyCode': 'EUR'}, 'retailPrice': {'amountInMicros': 110770000, 'currencyCode': 'EUR'}, 'giftable': True}]",FR,PARTIAL,True,False,ALLOWED,False,,True,http://books.google.fr/books/download/Applied_Data_Science-sample-pdf.acsm?id=JmydDwAAQBAJ&format=pdf&output=acs4_fulfillment_token&dl_type=sample&source=gbs_api,http://play.google.com/books/reader?id=JmydDwAAQBAJ&hl=&as_brr=6&source=gbs_api,SAMPLE,False,"This book has two main goals: to define data science through the work of data scientists and their results, namely data products, while simultaneously providing the reader with relevant lessons learned from applied data science projects at ...",,
29,books#volume,gkFPDwAAQBAJ,Hy9CHiFgbdg,https://www.googleapis.com/books/v1/volumes/gkFPDwAAQBAJ,Statistics for Data Science,"Leverage the power of statistics for Data Analysis, Classification, Regression, Machine Learning, and Neural Networks",['James D. Miller'],Packt Publishing Ltd,2017-11-17,"Get your statistics basics right before diving into the world of data science About This Book No need to take a degree in statistics, read this book and get a strong statistics base for data science and real-world programs; Implement statistics in data science tasks such as data cleaning, mining, and analysis Learn all about probability, statistics, numerical computations, and more with the help of R programs Who This Book Is For This book is intended for those developers who are willing to enter the field of data science and are looking for concise information of statistics with the help of insightful programs and simple explanation. Some basic hands on R will be useful. What You Will Learn Analyze the transition from a data developer to a data scientist mindset Get acquainted with the R programs and the logic used for statistical computations Understand mathematical concepts such as variance, standard deviation, probability, matrix calculations, and more Learn to implement statistics in data science tasks such as data cleaning, mining, and analysis Learn the statistical techniques required to perform tasks such as linear regression, regularization, model assessment, boosting, SVMs, and working with neural networks Get comfortable with performing various statistical computations for data science programmatically In Detail Data science is an ever-evolving field, which is growing in popularity at an exponential rate. Data science includes techniques and theories extracted from the fields of statistics; computer science, and, most importantly, machine learning, databases, data visualization, and so on. This book takes you through an entire journey of statistics, from knowing very little to becoming comfortable in using various statistical methods for data science tasks. It starts off with simple statistics and then move on to statistical methods that are used in data science algorithms. The R programs for statistical computation are clearly explained along with logic. You will come across various mathematical concepts, such as variance, standard deviation, probability, matrix calculations, and more. You will learn only what is required to implement statistics in data science tasks such as data cleaning, mining, and analysis. You will learn the statistical techniques required to perform tasks such as linear regression, regularization, model assessment, boosting, SVMs, and working with neural networks. By the end of the book, you will be comfortable with performing various statistical computations for data science programmatically. Style and approach Step by step comprehensive guide with real world examples","[{'type': 'ISBN_13', 'identifier': '9781788295345'}, {'type': 'ISBN_10', 'identifier': '178829534X'}]",True,True,279,BOOK,['Computers'],NOT_MATURE,False,1.5.3.0.preview.3,False,False,http://books.google.com/books/content?id=gkFPDwAAQBAJ&printsec=frontcover&img=1&zoom=5&edge=curl&source=gbs_api,http://books.google.com/books/content?id=gkFPDwAAQBAJ&printsec=frontcover&img=1&zoom=1&edge=curl&source=gbs_api,en,http://books.google.fr/books?id=gkFPDwAAQBAJ&printsec=frontcover&dq=data+science&hl=&as_brr=6&cd=30&source=gbs_api,https://play.google.com/store/books/details?id=gkFPDwAAQBAJ&source=gbs_api,https://play.google.com/store/books/details?id=gkFPDwAAQBAJ,FR,FOR_SALE,True,27.42,EUR,19.19,EUR,https://play.google.com/store/books/details?id=gkFPDwAAQBAJ&rdid=book-gkFPDwAAQBAJ&rdot=1&source=gbs_api,"[{'finskyOfferType': 1, 'listPrice': {'amountInMicros': 27420000, 'currencyCode': 'EUR'}, 'retailPrice': {'amountInMicros': 19190000, 'currencyCode': 'EUR'}, 'giftable': True}]",FR,PARTIAL,True,False,ALLOWED,True,,True,,http://play.google.com/books/reader?id=gkFPDwAAQBAJ&hl=&as_brr=6&source=gbs_api,SAMPLE,False,"Get your statistics basics right before diving into the world of data science About This Book No need to take a degree in statistics, read this book and get a strong statistics base for data science and real-world programs; Implement ...",,
30,books#volume,K2X8EAAAQBAJ,NkCyZYj39KA,https://www.googleapis.com/books/v1/volumes/K2X8EAAAQBAJ,"Artificial Intelligence, Data Science and Applications","ICAISE’2023, Volume 1","['Yousef Farhaoui', 'Amir Hussain', 'Tanzila Saba', 'Hamed Taherdoost', 'Anshul Verma']",Springer Nature,2024-03-04,"This book is to provide a comprehensive reference for professionals in the field of data science and applications: artificial intelligence, big data, IoT, and blockchain. In summary, this book is expected to function as a helpful resource and manual, enabling readers to navigate the intricate domain of artificial intelligence, the Internet of things (IoT), and blockchain in smart environments. This book covers many topics related to integrating AI, IoT, blockchain, and smart environments. It begins by laying a solid foundation, introducing each technology's fundamental concepts and principles. Subsequent chapters explore applications and real-world use cases, demonstrating how AI, IoT, and blockchain can effectively address critical challenges within data science and applications.","[{'type': 'ISBN_13', 'identifier': '9783031484650'}, {'type': 'ISBN_10', 'identifier': '3031484657'}]",True,True,590,BOOK,['Computers'],NOT_MATURE,False,0.3.1.0.preview.3,False,False,http://books.google.com/books/content?id=K2X8EAAAQBAJ&printsec=frontcover&img=1&zoom=5&edge=curl&source=gbs_api,http://books.google.com/books/content?id=K2X8EAAAQBAJ&printsec=frontcover&img=1&zoom=1&edge=curl&source=gbs_api,en,http://books.google.fr/books?id=K2X8EAAAQBAJ&printsec=frontcover&dq=data+science&hl=&as_brr=6&cd=31&source=gbs_api,https://play.google.com/store/books/details?id=K2X8EAAAQBAJ&source=gbs_api,https://play.google.com/store/books/details?id=K2X8EAAAQBAJ,FR,FOR_SALE,True,200.44,EUR,140.31,EUR,https://play.google.com/store/books/details?id=K2X8EAAAQBAJ&rdid=book-K2X8EAAAQBAJ&rdot=1&source=gbs_api,"[{'finskyOfferType': 1, 'listPrice': {'amountInMicros': 200440000, 'currencyCode': 'EUR'}, 'retailPrice': {'amountInMicros': 140310000, 'currencyCode': 'EUR'}, 'giftable': True}]",FR,PARTIAL,True,False,ALLOWED,True,http://books.google.fr/books/download/Artificial_Intelligence_Data_Science_and-sample-epub.acsm?id=K2X8EAAAQBAJ&format=epub&output=acs4_fulfillment_token&dl_type=sample&source=gbs_api,True,http://books.google.fr/books/download/Artificial_Intelligence_Data_Science_and-sample-pdf.acsm?id=K2X8EAAAQBAJ&format=pdf&output=acs4_fulfillment_token&dl_type=sample&source=gbs_api,http://play.google.com/books/reader?id=K2X8EAAAQBAJ&hl=&as_brr=6&source=gbs_api,SAMPLE,False,"This book is to provide a comprehensive reference for professionals in the field of data science and applications: artificial intelligence, big data, IoT, and blockchain.",,
31,books#volume,Drz4EAAAQBAJ,RFqKI6nhZcA,https://www.googleapis.com/books/v1/volumes/Drz4EAAAQBAJ,Data Science,,['Parveen Kumari'],BFC Publications,2024-03-02,"Data science is the study of how to extract useful information from data for students, strategic planning, and other purposes by using cutting-edge analytics methods, and scientific principles. Data science combines a number of fields, such as information technology, preparing data, data mining, predictive analytics, machine learning, and data visualization, in addition to statistics, mathematics, and software development.","[{'type': 'ISBN_13', 'identifier': '9789357644723'}, {'type': 'ISBN_10', 'identifier': '9357644725'}]",False,True,140,BOOK,['Science'],NOT_MATURE,False,0.1.0.0.preview.1,False,False,http://books.google.com/books/content?id=Drz4EAAAQBAJ&printsec=frontcover&img=1&zoom=5&edge=curl&source=gbs_api,http://books.google.com/books/content?id=Drz4EAAAQBAJ&printsec=frontcover&img=1&zoom=1&edge=curl&source=gbs_api,en,http://books.google.fr/books?id=Drz4EAAAQBAJ&printsec=frontcover&dq=data+science&hl=&as_brr=6&cd=32&source=gbs_api,https://play.google.com/store/books/details?id=Drz4EAAAQBAJ&source=gbs_api,https://play.google.com/store/books/details?id=Drz4EAAAQBAJ,FR,FOR_SALE,True,0.67,EUR,0.67,EUR,https://play.google.com/store/books/details?id=Drz4EAAAQBAJ&rdid=book-Drz4EAAAQBAJ&rdot=1&source=gbs_api,"[{'finskyOfferType': 1, 'listPrice': {'amountInMicros': 670000, 'currencyCode': 'EUR'}, 'retailPrice': {'amountInMicros': 670000, 'currencyCode': 'EUR'}, 'giftable': True}]",FR,PARTIAL,True,False,ALLOWED,False,,True,http://books.google.fr/books/download/Data_Science-sample-pdf.acsm?id=Drz4EAAAQBAJ&format=pdf&output=acs4_fulfillment_token&dl_type=sample&source=gbs_api,http://play.google.com/books/reader?id=Drz4EAAAQBAJ&hl=&as_brr=6&source=gbs_api,SAMPLE,False,"Data science is the study of how to extract useful information from data for students, strategic planning, and other purposes by using cutting-edge analytics methods, and scientific principles.",,
32,books#volume,b_7uEAAAQBAJ,NYV7MEYrrLQ,https://www.googleapis.com/books/v1/volumes/b_7uEAAAQBAJ,Data Science and Applications,"Proceedings of ICDSA 2023, Volume 3","['Satyasai Jagannath Nanda', 'Rajendra Prasad Yadav', 'Amir H. Gandomi', 'Mukesh Saraswat']",Springer Nature,2024-01-17,"This book gathers outstanding papers presented at the International Conference on Data Science and Applications (ICDSA 2023), organized by Soft Computing Research Society (SCRS) and Malaviya National Institute of Technology Jaipur, India, from 14 to 15 July 2023. The book is divided into four volumes, and it covers theoretical and empirical developments in various areas of big data analytics, big data technologies, decision tree learning, wireless communication, wireless sensor networking, bioinformatics and systems, artificial neural networks, deep learning, genetic algorithms, data mining, fuzzy logic, optimization algorithms, image processing, computational intelligence in civil engineering, and creative computing.","[{'type': 'ISBN_13', 'identifier': '9789819978175'}, {'type': 'ISBN_10', 'identifier': '9819978173'}]",True,True,596,BOOK,['Computers'],NOT_MATURE,False,1.2.2.0.preview.3,False,False,http://books.google.com/books/content?id=b_7uEAAAQBAJ&printsec=frontcover&img=1&zoom=5&edge=curl&source=gbs_api,http://books.google.com/books/content?id=b_7uEAAAQBAJ&printsec=frontcover&img=1&zoom=1&edge=curl&source=gbs_api,en,http://books.google.fr/books?id=b_7uEAAAQBAJ&printsec=frontcover&dq=data+science&hl=&as_brr=6&cd=33&source=gbs_api,https://play.google.com/store/books/details?id=b_7uEAAAQBAJ&source=gbs_api,https://play.google.com/store/books/details?id=b_7uEAAAQBAJ,FR,FOR_SALE,True,220.5,EUR,154.35,EUR,https://play.google.com/store/books/details?id=b_7uEAAAQBAJ&rdid=book-b_7uEAAAQBAJ&rdot=1&source=gbs_api,"[{'finskyOfferType': 1, 'listPrice': {'amountInMicros': 220500000, 'currencyCode': 'EUR'}, 'retailPrice': {'amountInMicros': 154350000, 'currencyCode': 'EUR'}, 'giftable': True}]",FR,PARTIAL,True,False,ALLOWED,True,http://books.google.fr/books/download/Data_Science_and_Applications-sample-epub.acsm?id=b_7uEAAAQBAJ&format=epub&output=acs4_fulfillment_token&dl_type=sample&source=gbs_api,True,http://books.google.fr/books/download/Data_Science_and_Applications-sample-pdf.acsm?id=b_7uEAAAQBAJ&format=pdf&output=acs4_fulfillment_token&dl_type=sample&source=gbs_api,http://play.google.com/books/reader?id=b_7uEAAAQBAJ&hl=&as_brr=6&source=gbs_api,SAMPLE,False,"This book gathers outstanding papers presented at the International Conference on Data Science and Applications (ICDSA 2023), organized by Soft Computing Research Society (SCRS) and Malaviya National Institute of Technology Jaipur, India, ...",,
33,books#volume,HR86EQAAQBAJ,S6tSX+Er8zM,https://www.googleapis.com/books/v1/volumes/HR86EQAAQBAJ,Advanced Interdisciplinary Applications of Deep Learning for Data Science,,"['Mathew Biju, Soly', 'Oroumchian, Farhad']",IGI Global,2024-12-18,"Advanced interdisciplinary applications of deep learning are revolutionizing the field of data science, enabling new solutions across industries. By leveraging neural networks and datasets, deep learning techniques are transforming how businesses analyze, interpret, and gain insights from complex data. In fields like healthcare, finance, engineering, and business, deep learning models can uncover patterns and make predictions to enhance data-driven decision-making while fostering new opportunities in areas like personalized medicine, autonomous systems, and predictive analytics. As deep learning continues evolves, its interdisciplinary impact expands, creating new possibilities for solving challenges in data science. Advanced Interdisciplinary Applications of Deep Learning for Data Science explores innovations of deep learning technology in data science for various industries and sectors. It examines solutions for decision-making and patient or customer service using machine learning, AI, and predictive analytics. This book covers topics such as bioinformatics, environmental monitoring, and medical diseases, and is a useful resource for data scientists, computer engineers, medical professionals, academicians, and researchers.","[{'type': 'ISBN_13', 'identifier': '9798369347614'}]",False,True,394,BOOK,['Computers'],NOT_MATURE,False,0.0.1.0.preview.1,False,False,http://books.google.com/books/content?id=HR86EQAAQBAJ&printsec=frontcover&img=1&zoom=5&edge=curl&source=gbs_api,http://books.google.com/books/content?id=HR86EQAAQBAJ&printsec=frontcover&img=1&zoom=1&edge=curl&source=gbs_api,en,http://books.google.fr/books?id=HR86EQAAQBAJ&printsec=frontcover&dq=data+science&hl=&as_brr=6&cd=34&source=gbs_api,https://play.google.com/store/books/details?id=HR86EQAAQBAJ&source=gbs_api,https://play.google.com/store/books/details?id=HR86EQAAQBAJ,FR,FOR_SALE,True,235.17,EUR,164.62,EUR,https://play.google.com/store/books/details?id=HR86EQAAQBAJ&rdid=book-HR86EQAAQBAJ&rdot=1&source=gbs_api,"[{'finskyOfferType': 1, 'listPrice': {'amountInMicros': 235170000, 'currencyCode': 'EUR'}, 'retailPrice': {'amountInMicros': 164620000, 'currencyCode': 'EUR'}, 'giftable': True}]",FR,PARTIAL,True,False,ALLOWED,False,,True,http://books.google.fr/books/download/Advanced_Interdisciplinary_Applications-sample-pdf.acsm?id=HR86EQAAQBAJ&format=pdf&output=acs4_fulfillment_token&dl_type=sample&source=gbs_api,http://play.google.com/books/reader?id=HR86EQAAQBAJ&hl=&as_brr=6&source=gbs_api,SAMPLE,False,"This book covers topics such as bioinformatics, environmental monitoring, and medical diseases, and is a useful resource for data scientists, computer engineers, medical professionals, academicians, and researchers.",,
34,books#volume,ZjJBEQAAQBAJ,NqQ++kFPAJs,https://www.googleapis.com/books/v1/volumes/ZjJBEQAAQBAJ,Data Science and AI Simplified,,['Ekaaksh Deshpande'],Educohack Press,2025-01-03,"The illustrations in this book are created by “Team Educohack”. Data Science and AI Simplified provides comprehensive knowledge on the theories, techniques, and applications in Analytics, Data Science, and Artificial Intelligence (AI). We cover the entire analytics process, from data collection and processing to analysis and interpretation, helping you derive valuable insights that can significantly impact businesses. We explain data science, focusing on how to transform raw data into valuable information for strategic business development. By analyzing large amounts of structured and unstructured data, organizations can identify patterns, reduce costs, and increase performance and efficiency. Our book also explores AI, demonstrating how machines learn from experience, adapt to new inputs, and perform human-like tasks. From chess-playing computers to self-driving cars, we delve into AI applications that rely on deep learning and natural language processing. Whether you're a beginner or looking to expand your expertise, Data Science and AI Simplified offers clear, easy-to-understand explanations and practical examples, ensuring a thorough grasp of these essential fields.","[{'type': 'ISBN_13', 'identifier': '9789361523434'}, {'type': 'ISBN_10', 'identifier': '9361523430'}]",True,True,203,BOOK,['Computers'],NOT_MATURE,False,1.1.1.0.preview.3,False,False,http://books.google.com/books/content?id=ZjJBEQAAQBAJ&printsec=frontcover&img=1&zoom=5&edge=curl&source=gbs_api,http://books.google.com/books/content?id=ZjJBEQAAQBAJ&printsec=frontcover&img=1&zoom=1&edge=curl&source=gbs_api,en,http://books.google.fr/books?id=ZjJBEQAAQBAJ&printsec=frontcover&dq=data+science&hl=&as_brr=6&cd=35&source=gbs_api,https://play.google.com/store/books/details?id=ZjJBEQAAQBAJ&source=gbs_api,https://play.google.com/store/books/details?id=ZjJBEQAAQBAJ,FR,FOR_SALE,True,25.61,EUR,25.61,EUR,https://play.google.com/store/books/details?id=ZjJBEQAAQBAJ&rdid=book-ZjJBEQAAQBAJ&rdot=1&source=gbs_api,"[{'finskyOfferType': 1, 'listPrice': {'amountInMicros': 25610000, 'currencyCode': 'EUR'}, 'retailPrice': {'amountInMicros': 25610000, 'currencyCode': 'EUR'}, 'giftable': True}]",FR,PARTIAL,True,False,ALLOWED,True,http://books.google.fr/books/download/Data_Science_and_AI_Simplified-sample-epub.acsm?id=ZjJBEQAAQBAJ&format=epub&output=acs4_fulfillment_token&dl_type=sample&source=gbs_api,True,http://books.google.fr/books/download/Data_Science_and_AI_Simplified-sample-pdf.acsm?id=ZjJBEQAAQBAJ&format=pdf&output=acs4_fulfillment_token&dl_type=sample&source=gbs_api,http://play.google.com/books/reader?id=ZjJBEQAAQBAJ&hl=&as_brr=6&source=gbs_api,SAMPLE,False,"The illustrations in this book are created by “Team Educohack”. Data Science and AI Simplified provides comprehensive knowledge on the theories, techniques, and applications in Analytics, Data Science, and Artificial Intelligence (AI).",,
35,books#volume,t-ncDwAAQBAJ,R1n/FQ+uMWQ,https://www.googleapis.com/books/v1/volumes/t-ncDwAAQBAJ,Data Science Uncovering the Reality,IITians uncover how Data Science is transforming some of the world's biggest companies,"['Pulkit Bansal, Kunal Kishore, Pankaj Gupta, Srijan Saket, Neeraj Kumar']",Notion Press,2020-04-15,"Data Science has become a popular field of work today. However a good resource to understand applied Data Science is still missing. In Data Science Uncovering the Reality, a group of IITians unravel how Data Science is done in the industry. They have interviewed Data Science and technology leaders at top companies in India and presented their learnings here. This book will give you honest answers to questions such as: How to build a career in Data Science? How A.I. is used in the world’s most successful companies. How Data Science leaders actually work and the challenges they face.","[{'type': 'ISBN_13', 'identifier': '9781648699665'}, {'type': 'ISBN_10', 'identifier': '1648699669'}]",True,False,139,BOOK,['Computers'],NOT_MATURE,False,1.2.2.0.preview.2,False,False,http://books.google.com/books/content?id=t-ncDwAAQBAJ&printsec=frontcover&img=1&zoom=5&edge=curl&source=gbs_api,http://books.google.com/books/content?id=t-ncDwAAQBAJ&printsec=frontcover&img=1&zoom=1&edge=curl&source=gbs_api,en,http://books.google.fr/books?id=t-ncDwAAQBAJ&printsec=frontcover&dq=data+science&hl=&as_brr=6&cd=36&source=gbs_api,https://play.google.com/store/books/details?id=t-ncDwAAQBAJ&source=gbs_api,https://play.google.com/store/books/details?id=t-ncDwAAQBAJ,FR,FOR_SALE,True,2.67,EUR,2.67,EUR,https://play.google.com/store/books/details?id=t-ncDwAAQBAJ&rdid=book-t-ncDwAAQBAJ&rdot=1&source=gbs_api,"[{'finskyOfferType': 1, 'listPrice': {'amountInMicros': 2670000, 'currencyCode': 'EUR'}, 'retailPrice': {'amountInMicros': 2670000, 'currencyCode': 'EUR'}, 'giftable': True}]",FR,PARTIAL,True,False,ALLOWED,True,,False,,http://play.google.com/books/reader?id=t-ncDwAAQBAJ&hl=&as_brr=6&source=gbs_api,SAMPLE,False,They have interviewed Data Science and technology leaders at top companies in India and presented their learnings here. This book will give you honest answers to questions such as: How to build a career in Data Science?,,
