,kind,id,etag,selfLink,volumeInfo.title,volumeInfo.subtitle,volumeInfo.authors,volumeInfo.publisher,volumeInfo.publishedDate,volumeInfo.description,volumeInfo.industryIdentifiers,volumeInfo.readingModes.text,volumeInfo.readingModes.image,volumeInfo.pageCount,volumeInfo.printType,volumeInfo.categories,volumeInfo.maturityRating,volumeInfo.allowAnonLogging,volumeInfo.contentVersion,volumeInfo.panelizationSummary.containsEpubBubbles,volumeInfo.panelizationSummary.containsImageBubbles,volumeInfo.imageLinks.smallThumbnail,volumeInfo.imageLinks.thumbnail,volumeInfo.language,volumeInfo.previewLink,volumeInfo.infoLink,volumeInfo.canonicalVolumeLink,saleInfo.country,saleInfo.saleability,saleInfo.isEbook,saleInfo.listPrice.amount,saleInfo.listPrice.currencyCode,saleInfo.retailPrice.amount,saleInfo.retailPrice.currencyCode,saleInfo.buyLink,saleInfo.offers,accessInfo.country,accessInfo.viewability,accessInfo.embeddable,accessInfo.publicDomain,accessInfo.textToSpeechPermission,accessInfo.epub.isAvailable,accessInfo.epub.acsTokenLink,accessInfo.pdf.isAvailable,accessInfo.pdf.acsTokenLink,accessInfo.webReaderLink,accessInfo.accessViewStatus,accessInfo.quoteSharingAllowed,searchInfo.textSnippet,volumeInfo.averageRating,volumeInfo.ratingsCount
0,books#volume,BwglDwAAQBAJ,Twcec2qVRf0,https://www.googleapis.com/books/v1/volumes/BwglDwAAQBAJ,Data Science par la pratique,Principes avec Python,['Joel Grus'],Editions Eyrolles,2017-05-25,"Un ouvrage de référence pour les (futurs) data scientists Les bibliothèques, les frameworks, les modules et les boîtes à outils sont parfaits pour faire de la data science. Ils sont aussi un bon moyen de plonger dans la discipline sans comprendre la data science. Dans cet ouvrage, vous apprendrez comment fonctionnent les outils et algorithmes les plus fondamentaux de la data science, en les réalisant à partir de zéro. Si vous êtes fort en maths et que vous connaissez la programmation, l'auteur, Joël Grus, vous aidera à vous familiariser avec les maths et les statistiques qui sont au coeur de la data science et à acquérir les compétences informatiques indispensables pour démarrer comme data scientist. La profusion des données d'aujourd'hui contient les réponses aux questions que personne n'a encore pensé à poser. Ce livre vous enseigne comment obtenir ces réponses. Suivez un cours accéléré de Python Apprenez les fondamentaux de l'algèbre linéaire, des statistiques et des probabilités, et comprenez comment et quand les utiliser en data science Collectez, explorez, nettoyez, bricolez et manipulez les données Plongez dans les bases de l'apprentissage automatique Implémentez des modèles comme les k plus proches voisins, le Bayes naïf, les régressions linéaire ou logistique, les arbres de décision, les réseaux neuronaux et le clustering Explorez les systèmes de recommandation, le traitement du langage naturel, l'analyse de réseau, MapReduce et les bases de données À qui s'adresse cet ouvrage ? Aux développeurs, statisticiens, étudiants et chefs de projet ayant à résoudre des problèmes de data science. Aux data scientists, mais aussi à toute personne curieuse d'avoir une vue d'ensemble de l'état de l'art de ce métier du futur.","[{'type': 'ISBN_13', 'identifier': '9782212255478'}, {'type': 'ISBN_10', 'identifier': '2212255470'}]",True,True,319,BOOK,['Computers'],NOT_MATURE,True,1.13.12.0.preview.3,False,False,http://books.google.com/books/content?id=BwglDwAAQBAJ&printsec=frontcover&img=1&zoom=5&edge=curl&source=gbs_api,http://books.google.com/books/content?id=BwglDwAAQBAJ&printsec=frontcover&img=1&zoom=1&edge=curl&source=gbs_api,fr,http://books.google.fr/books?id=BwglDwAAQBAJ&printsec=frontcover&dq=data+science&hl=&as_brr=6&cd=1&source=gbs_api,https://play.google.com/store/books/details?id=BwglDwAAQBAJ&source=gbs_api,https://play.google.com/store/books/details?id=BwglDwAAQBAJ,FR,FOR_SALE,True,26.99,EUR,26.99,EUR,https://play.google.com/store/books/details?id=BwglDwAAQBAJ&rdid=book-BwglDwAAQBAJ&rdot=1&source=gbs_api,"[{'finskyOfferType': 1, 'listPrice': {'amountInMicros': 26990000, 'currencyCode': 'EUR'}, 'retailPrice': {'amountInMicros': 26990000, 'currencyCode': 'EUR'}, 'giftable': True}]",FR,PARTIAL,True,False,ALLOWED,True,http://books.google.fr/books/download/Data_Science_par_la_pratique-sample-epub.acsm?id=BwglDwAAQBAJ&format=epub&output=acs4_fulfillment_token&dl_type=sample&source=gbs_api,True,http://books.google.fr/books/download/Data_Science_par_la_pratique-sample-pdf.acsm?id=BwglDwAAQBAJ&format=pdf&output=acs4_fulfillment_token&dl_type=sample&source=gbs_api,http://play.google.com/books/reader?id=BwglDwAAQBAJ&hl=&as_brr=6&source=gbs_api,SAMPLE,False,"Si vous êtes fort en maths et que vous connaissez la programmation, l&#39;auteur, Joël Grus, vous aidera à vous familiariser avec les maths et les statistiques qui sont au coeur de la data science et à acquérir les compétences ...",,
1,books#volume,wRo3EQAAQBAJ,iuDpWijlDZo,https://www.googleapis.com/books/v1/volumes/wRo3EQAAQBAJ,Python en pratique pour le data scientist,edition 2024,['Patrice Rey'],BoD - Books on Demand,2024-12-10,"Python s'est imposé ces dernières années comme un langage de programmation incontournable dans de nombreux domaines. En science des données (data science), il se distingue comme un outil essentiel pour mener à bien des projets complexes grâce à son caractère universel. Il constitue aujourd'hui l'outil de choix pour la création de prototypes et un allié incontournable dans les domaines du big data, du machine learning, du deep learning et de l'intelligence artificielle. Cet ouvrage a pour but de vous accompagner dans la découverte de Python, un langage à la fois simple d'utilisation et puissant pour les utilisateurs travaillant avec les données. L'objectif est de vous fournir les connaissances nécessaires pour comprendre et maitriser Python dans le contexte de la data science. Pour quiconque aspire à devenir data scientist ou l'est déjà, la maitrise de Python est désormais un impératif.","[{'type': 'ISBN_13', 'identifier': '9782322620685'}, {'type': 'ISBN_10', 'identifier': '2322620688'}]",False,True,505,BOOK,['Computers'],NOT_MATURE,False,preview-1.0.0,False,False,http://books.google.com/books/content?id=wRo3EQAAQBAJ&printsec=frontcover&img=1&zoom=5&edge=curl&source=gbs_api,http://books.google.com/books/content?id=wRo3EQAAQBAJ&printsec=frontcover&img=1&zoom=1&edge=curl&source=gbs_api,fr,http://books.google.fr/books?id=wRo3EQAAQBAJ&printsec=frontcover&dq=data+science&hl=&as_brr=6&cd=2&source=gbs_api,https://play.google.com/store/books/details?id=wRo3EQAAQBAJ&source=gbs_api,https://play.google.com/store/books/details?id=wRo3EQAAQBAJ,FR,FOR_SALE,True,30.99,EUR,30.99,EUR,https://play.google.com/store/books/details?id=wRo3EQAAQBAJ&rdid=book-wRo3EQAAQBAJ&rdot=1&source=gbs_api,"[{'finskyOfferType': 1, 'listPrice': {'amountInMicros': 30990000, 'currencyCode': 'EUR'}, 'retailPrice': {'amountInMicros': 30990000, 'currencyCode': 'EUR'}, 'giftable': True}]",FR,PARTIAL,True,False,ALLOWED,False,,True,http://books.google.fr/books/download/Python_en_pratique_pour_le_data_scientis-sample-pdf.acsm?id=wRo3EQAAQBAJ&format=pdf&output=acs4_fulfillment_token&dl_type=sample&source=gbs_api,http://play.google.com/books/reader?id=wRo3EQAAQBAJ&hl=&as_brr=6&source=gbs_api,SAMPLE,False,Python s&#39;est imposé ces dernières années comme un langage de programmation incontournable dans de nombreux domaines.,,
2,books#volume,bTozEAAAQBAJ,e6RgLmVUfDA,https://www.googleapis.com/books/v1/volumes/bTozEAAAQBAJ,Introducing Data Science,"Big data, machine learning, and more, using Python tools","['Davy Cielen', 'Arno Meysman']",Simon and Schuster,2016-05-02,"Summary Introducing Data Science teaches you how to accomplish the fundamental tasks that occupy data scientists. Using the Python language and common Python libraries, you'll experience firsthand the challenges of dealing with data at scale and gain a solid foundation in data science. Purchase of the print book includes a free eBook in PDF, Kindle, and ePub formats from Manning Publications. About the Technology Many companies need developers with data science skills to work on projects ranging from social media marketing to machine learning. Discovering what you need to learn to begin a career as a data scientist can seem bewildering. This book is designed to help you get started. About the Book Introducing Data ScienceIntroducing Data Science explains vital data science concepts and teaches you how to accomplish the fundamental tasks that occupy data scientists. You’ll explore data visualization, graph databases, the use of NoSQL, and the data science process. You’ll use the Python language and common Python libraries as you experience firsthand the challenges of dealing with data at scale. Discover how Python allows you to gain insights from data sets so big that they need to be stored on multiple machines, or from data moving so quickly that no single machine can handle it. This book gives you hands-on experience with the most popular Python data science libraries, Scikit-learn and StatsModels. After reading this book, you’ll have the solid foundation you need to start a career in data science. What’s Inside Handling large data Introduction to machine learning Using Python to work with data Writing data science algorithms About the Reader This book assumes you're comfortable reading code in Python or a similar language, such as C, Ruby, or JavaScript. No prior experience with data science is required. About the Authors Davy Cielen, Arno D. B. Meysman, and Mohamed Ali are the founders and managing partners of Optimately and Maiton, where they focus on developing data science projects and solutions in various sectors. Table of Contents Data science in a big data world The data science process Machine learning Handling large data on a single computer First steps in big data Join the NoSQL movement The rise of graph databases Text mining and text analytics Data visualization to the end user","[{'type': 'ISBN_13', 'identifier': '9781638352495'}, {'type': 'ISBN_10', 'identifier': '1638352496'}]",True,False,489,BOOK,['Computers'],NOT_MATURE,False,1.2.2.0.preview.2,False,False,http://books.google.com/books/content?id=bTozEAAAQBAJ&printsec=frontcover&img=1&zoom=5&edge=curl&source=gbs_api,http://books.google.com/books/content?id=bTozEAAAQBAJ&printsec=frontcover&img=1&zoom=1&edge=curl&source=gbs_api,en,http://books.google.fr/books?id=bTozEAAAQBAJ&pg=PA1&dq=data+science&hl=&as_brr=6&cd=3&source=gbs_api,https://play.google.com/store/books/details?id=bTozEAAAQBAJ&source=gbs_api,https://play.google.com/store/books/details?id=bTozEAAAQBAJ,FR,FOR_SALE,True,34.12,EUR,34.12,EUR,https://play.google.com/store/books/details?id=bTozEAAAQBAJ&rdid=book-bTozEAAAQBAJ&rdot=1&source=gbs_api,"[{'finskyOfferType': 1, 'listPrice': {'amountInMicros': 34120000, 'currencyCode': 'EUR'}, 'retailPrice': {'amountInMicros': 34120000, 'currencyCode': 'EUR'}, 'giftable': True}]",FR,PARTIAL,True,False,ALLOWED_FOR_ACCESSIBILITY,True,http://books.google.fr/books/download/Introducing_Data_Science-sample-epub.acsm?id=bTozEAAAQBAJ&format=epub&output=acs4_fulfillment_token&dl_type=sample&source=gbs_api,False,,http://play.google.com/books/reader?id=bTozEAAAQBAJ&hl=&as_brr=6&source=gbs_api,SAMPLE,False,"This book gives you hands-on experience with the most popular Python data science libraries, Scikit-learn and StatsModels. After reading this book, you’ll have the solid foundation you need to start a career in data science.",,
3,books#volume,4ZctAAAAQBAJ,ZbONjuE20cQ,https://www.googleapis.com/books/v1/volumes/4ZctAAAAQBAJ,Data Science for Business,What You Need to Know about Data Mining and Data-Analytic Thinking,"['Foster Provost', 'Tom Fawcett']","""O'Reilly Media, Inc.""",2013-07-27,"Written by renowned data science experts Foster Provost and Tom Fawcett, Data Science for Business introduces the fundamental principles of data science, and walks you through the ""data-analytic thinking"" necessary for extracting useful knowledge and business value from the data you collect. This guide also helps you understand the many data-mining techniques in use today. Based on an MBA course Provost has taught at New York University over the past ten years, Data Science for Business provides examples of real-world business problems to illustrate these principles. You’ll not only learn how to improve communication between business stakeholders and data scientists, but also how participate intelligently in your company’s data science projects. You’ll also discover how to think data-analytically, and fully appreciate how data science methods can support business decision-making. Understand how data science fits in your organization—and how you can use it for competitive advantage Treat data as a business asset that requires careful investment if you’re to gain real value Approach business problems data-analytically, using the data-mining process to gather good data in the most appropriate way Learn general concepts for actually extracting knowledge from data Apply data science principles when interviewing data science job candidates","[{'type': 'ISBN_13', 'identifier': '9781449374280'}, {'type': 'ISBN_10', 'identifier': '144937428X'}]",True,True,506,BOOK,['Computers'],NOT_MATURE,True,1.13.14.0.preview.3,False,False,http://books.google.com/books/content?id=4ZctAAAAQBAJ&printsec=frontcover&img=1&zoom=5&edge=curl&source=gbs_api,http://books.google.com/books/content?id=4ZctAAAAQBAJ&printsec=frontcover&img=1&zoom=1&edge=curl&source=gbs_api,en,http://books.google.fr/books?id=4ZctAAAAQBAJ&printsec=frontcover&dq=data+science&hl=&as_brr=6&cd=4&source=gbs_api,https://play.google.com/store/books/details?id=4ZctAAAAQBAJ&source=gbs_api,https://play.google.com/store/books/details?id=4ZctAAAAQBAJ,FR,FOR_SALE,True,28.48,EUR,28.48,EUR,https://play.google.com/store/books/details?id=4ZctAAAAQBAJ&rdid=book-4ZctAAAAQBAJ&rdot=1&source=gbs_api,"[{'finskyOfferType': 1, 'listPrice': {'amountInMicros': 28480000, 'currencyCode': 'EUR'}, 'retailPrice': {'amountInMicros': 28480000, 'currencyCode': 'EUR'}, 'giftable': True}]",FR,PARTIAL,True,False,ALLOWED,True,,True,,http://play.google.com/books/reader?id=4ZctAAAAQBAJ&hl=&as_brr=6&source=gbs_api,SAMPLE,False,This guide also helps you understand the many data-mining techniques in use today.,,
4,books#volume,zDHDDwAAQBAJ,K1NOlNWB+SE,https://www.googleapis.com/books/v1/volumes/zDHDDwAAQBAJ,Python pour la Data science Pour les Nuls,,['John Paul Mueller'],Pour les nuls,2020-01-02,"Découvrez Python le langage de prédilection de la science des données La science des données ou data science consiste à extraire des connaissance dans un flot de données. Elle utilise des techniques et des théories tirées de domaines comme les mathématiques et la statistique. Les méthodes qui s'adaptent aux big data sont particulièrement intéressantes dans la science des données. Ce livre est destiné à tous ceux qui travaillent dans le domaine de l'analyse de données et montre comment mettre en oeuvre le langage Python pour dans ce domaine et uassi celui de la statistique. Il traite également de Google Colab, un outil qui permet d'cire du code Python dans le cloud. Au programme : Probabilités Distributions aléatoires Tests d'hypothèses Regressions Modèles de prédiction","[{'type': 'ISBN_13', 'identifier': '9782412053461'}, {'type': 'ISBN_10', 'identifier': '2412053464'}]",True,True,620,BOOK,['Computers'],NOT_MATURE,True,1.1.1.0.preview.3,False,False,http://books.google.com/books/content?id=zDHDDwAAQBAJ&printsec=frontcover&img=1&zoom=5&edge=curl&source=gbs_api,http://books.google.com/books/content?id=zDHDDwAAQBAJ&printsec=frontcover&img=1&zoom=1&edge=curl&source=gbs_api,fr,http://books.google.fr/books?id=zDHDDwAAQBAJ&pg=PT597&dq=data+science&hl=&as_brr=6&cd=5&source=gbs_api,https://play.google.com/store/books/details?id=zDHDDwAAQBAJ&source=gbs_api,https://play.google.com/store/books/details?id=zDHDDwAAQBAJ,FR,FOR_SALE,True,16.99,EUR,16.99,EUR,https://play.google.com/store/books/details?id=zDHDDwAAQBAJ&rdid=book-zDHDDwAAQBAJ&rdot=1&source=gbs_api,"[{'finskyOfferType': 1, 'listPrice': {'amountInMicros': 16990000, 'currencyCode': 'EUR'}, 'retailPrice': {'amountInMicros': 16990000, 'currencyCode': 'EUR'}, 'giftable': True}]",FR,PARTIAL,True,False,ALLOWED,True,http://books.google.fr/books/download/Python_pour_la_Data_science_Pour_les_Nul-sample-epub.acsm?id=zDHDDwAAQBAJ&format=epub&output=acs4_fulfillment_token&dl_type=sample&source=gbs_api,True,http://books.google.fr/books/download/Python_pour_la_Data_science_Pour_les_Nul-sample-pdf.acsm?id=zDHDDwAAQBAJ&format=pdf&output=acs4_fulfillment_token&dl_type=sample&source=gbs_api,http://play.google.com/books/reader?id=zDHDDwAAQBAJ&hl=&as_brr=6&source=gbs_api,SAMPLE,False,... liens pour accéder au plateau : Data Analytics Post ( en français ) Malgré son titre. https : //www.universite-paris- saclay.fr/fr/bdbc/<b>data</b>-<b>sciences</b>-cartographie- des - 45 - formations https://www.<b>datascience</b>-paris-saclay.fr/,,
5,books#volume,g-xqDwAAQBAJ,uh0n7wRHjts,https://www.googleapis.com/books/v1/volumes/g-xqDwAAQBAJ,Data Science and Predictive Analytics,Biomedical and Health Applications using R,['Ivo D. Dinov'],Springer,2018-08-27,"Over the past decade, Big Data have become ubiquitous in all economic sectors, scientific disciplines, and human activities. They have led to striking technological advances, affecting all human experiences. Our ability to manage, understand, interrogate, and interpret such extremely large, multisource, heterogeneous, incomplete, multiscale, and incongruent data has not kept pace with the rapid increase of the volume, complexity and proliferation of the deluge of digital information. There are three reasons for this shortfall. First, the volume of data is increasing much faster than the corresponding rise of our computational processing power (Kryder’s law > Moore’s law). Second, traditional discipline-bounds inhibit expeditious progress. Third, our education and training activities have fallen behind the accelerated trend of scientific, information, and communication advances. There are very few rigorous instructional resources, interactive learning materials, and dynamic training environments that support active data science learning. The textbook balances the mathematical foundations with dexterous demonstrations and examples of data, tools, modules and workflows that serve as pillars for the urgently needed bridge to close that supply and demand predictive analytic skills gap. Exposing the enormous opportunities presented by the tsunami of Big data, this textbook aims to identify specific knowledge gaps, educational barriers, and workforce readiness deficiencies. Specifically, it focuses on the development of a transdisciplinary curriculum integrating modern computational methods, advanced data science techniques, innovative biomedical applications, and impactful health analytics. The content of this graduate-level textbook fills a substantial gap in integrating modern engineering concepts, computational algorithms, mathematical optimization, statistical computing and biomedical inference. Big data analytic techniques and predictive scientific methods demand broad transdisciplinary knowledge, appeal to an extremely wide spectrum of readers/learners, and provide incredible opportunities for engagement throughout the academy, industry, regulatory and funding agencies. The two examples below demonstrate the powerful need for scientific knowledge, computational abilities, interdisciplinary expertise, and modern technologies necessary to achieve desired outcomes (improving human health and optimizing future return on investment). This can only be achieved by appropriately trained teams of researchers who can develop robust decision support systems using modern techniques and effective end-to-end protocols, like the ones described in this textbook. • A geriatric neurologist is examining a patient complaining of gait imbalance and posture instability. To determine if the patient may suffer from Parkinson’s disease, the physician acquires clinical, cognitive, phenotypic, imaging, and genetics data (Big Data). Most clinics and healthcare centers are not equipped with skilled data analytic teams that can wrangle, harmonize and interpret such complex datasets. A learner that completes a course of study using this textbook will have the competency and ability to manage the data, generate a protocol for deriving biomarkers, and provide an actionable decision support system. The results of this protocol will help the physician understand the entire patient dataset and assist in making a holistic evidence-based, data-driven, clinical diagnosis. • To improve the return on investment for their shareholders, a healthcare manufacturer needs to forecast the demand for their product subject to environmental, demographic, economic, and bio-social sentiment data (Big Data). The organization’s data-analytics team is tasked with developing a protocol that identifies, aggregates, harmonizes, models and analyzes these heterogeneous data elements to generate a trend forecast. This system needs to provide an automated, adaptive, scalable, and reliable prediction of the optimal investment, e.g., R&D allocation, that maximizes the company’s bottom line. A reader that complete a course of study using this textbook will be able to ingest the observed structured and unstructured data, mathematically represent the data as a computable object, apply appropriate model-based and model-free prediction techniques. The results of these techniques may be used to forecast the expected relation between the company’s investment, product supply, general demand of healthcare (providers and patients), and estimate the return on initial investments.","[{'type': 'ISBN_13', 'identifier': '9783319723471'}, {'type': 'ISBN_10', 'identifier': '3319723472'}]",True,True,851,BOOK,['Computers'],NOT_MATURE,False,0.2.3.0.preview.3,False,False,http://books.google.com/books/content?id=g-xqDwAAQBAJ&printsec=frontcover&img=1&zoom=5&edge=curl&source=gbs_api,http://books.google.com/books/content?id=g-xqDwAAQBAJ&printsec=frontcover&img=1&zoom=1&edge=curl&source=gbs_api,en,http://books.google.fr/books?id=g-xqDwAAQBAJ&printsec=frontcover&dq=data+science&hl=&as_brr=6&cd=6&source=gbs_api,https://play.google.com/store/books/details?id=g-xqDwAAQBAJ&source=gbs_api,https://play.google.com/store/books/details?id=g-xqDwAAQBAJ,FR,FOR_SALE,True,63.29,EUR,41.14,EUR,https://play.google.com/store/books/details?id=g-xqDwAAQBAJ&rdid=book-g-xqDwAAQBAJ&rdot=1&source=gbs_api,"[{'finskyOfferType': 1, 'listPrice': {'amountInMicros': 63290000, 'currencyCode': 'EUR'}, 'retailPrice': {'amountInMicros': 41140000, 'currencyCode': 'EUR'}, 'giftable': True}]",FR,PARTIAL,True,False,ALLOWED,True,http://books.google.fr/books/download/Data_Science_and_Predictive_Analytics-sample-epub.acsm?id=g-xqDwAAQBAJ&format=epub&output=acs4_fulfillment_token&dl_type=sample&source=gbs_api,True,http://books.google.fr/books/download/Data_Science_and_Predictive_Analytics-sample-pdf.acsm?id=g-xqDwAAQBAJ&format=pdf&output=acs4_fulfillment_token&dl_type=sample&source=gbs_api,http://play.google.com/books/reader?id=g-xqDwAAQBAJ&hl=&as_brr=6&source=gbs_api,SAMPLE,False,"There are three reasons for this shortfall. First, the volume of data is increasing much faster than the corresponding rise of our computational processing power (Kryder’s law &gt; Moore’s law).",,
