12,books#volume,7yI6EQAAQBAJ,YKGIyRy3pU4,https://www.googleapis.com/books/v1/volumes/7yI6EQAAQBAJ,Big Data Analytics and Data Science,"Proceedings of Eighth International Conference on Information System Design and Intelligent Applications (ISDIA 2024), Volume 3","['Vikrant Bhateja', 'Hong Lin', 'Milan Simic', 'Jinshan Tang', 'Vustikayala Sivakumar Reddy']",Springer Nature,2024-12-23,"This book presents a collection of high-quality, peer-reviewed research papers from the 8th International Conference on Information System Design and Intelligent Applications (ISDIA 2024), held in Dubai, UAE, from 3 - 4 January 2024. It covers a wide range of topics in computer science and information technology, including data mining and data warehousing, high-performance computing, parallel and distributed computing, computational intelligence, soft computing, big data, cloud computing, grid computing, cognitive computing, and information security.","[{'type': 'ISBN_13', 'identifier': '9789819786664'}, {'type': 'ISBN_10', 'identifier': '9819786665'}]",True,True,534,BOOK,['Computers'],NOT_MATURE,False,1.1.1.0.preview.3,False,False,http://books.google.com/books/content?id=7yI6EQAAQBAJ&printsec=frontcover&img=1&zoom=5&edge=curl&source=gbs_api,http://books.google.com/books/content?id=7yI6EQAAQBAJ&printsec=frontcover&img=1&zoom=1&edge=curl&source=gbs_api,en,http://books.google.fr/books?id=7yI6EQAAQBAJ&printsec=frontcover&dq=data+science&hl=&as_brr=6&cd=13&source=gbs_api,https://play.google.com/store/books/details?id=7yI6EQAAQBAJ&source=gbs_api,https://play.google.com/store/books/details?id=7yI6EQAAQBAJ,FR,FOR_SALE,True,232.09,EUR,162.46,EUR,https://play.google.com/store/books/details?id=7yI6EQAAQBAJ&rdid=book-7yI6EQAAQBAJ&rdot=1&source=gbs_api,"[{'finskyOfferType': 1, 'listPrice': {'amountInMicros': 232090000, 'currencyCode': 'EUR'}, 'retailPrice': {'amountInMicros': 162460000, 'currencyCode': 'EUR'}, 'giftable': True}]",FR,PARTIAL,True,False,ALLOWED,True,http://books.google.fr/books/download/Big_Data_Analytics_and_Data_Science-sample-epub.acsm?id=7yI6EQAAQBAJ&format=epub&output=acs4_fulfillment_token&dl_type=sample&source=gbs_api,True,http://books.google.fr/books/download/Big_Data_Analytics_and_Data_Science-sample-pdf.acsm?id=7yI6EQAAQBAJ&format=pdf&output=acs4_fulfillment_token&dl_type=sample&source=gbs_api,http://play.google.com/books/reader?id=7yI6EQAAQBAJ&hl=&as_brr=6&source=gbs_api,SAMPLE,False,"This book presents a collection of high-quality, peer-reviewed research papers from the 8th International Conference on Information System Design and Intelligent Applications (ISDIA 2024), held in Dubai, UAE, from 3 - 4 January 2024.",,
13,books#volume,FpLUEAAAQBAJ,OCfGJr7j9pU,https://www.googleapis.com/books/v1/volumes/FpLUEAAAQBAJ,Data Science,An Introduction to Statistics and Machine Learning,['Matthias Plaue'],Springer Nature,2023-08-31,"This textbook provides an easy-to-understand introduction to the mathematical concepts and algorithms at the foundation of data science. It covers essential parts of data organization, descriptive and inferential statistics, probability theory, and machine learning. These topics are presented in a clear and mathematical sound way to help readers gain a deep and fundamental understanding. Numerous application examples based on real data are included. The book is well-suited for lecturers and students at technical universities, and offers a good introduction and overview for people who are new to the subject. Basic mathematical knowledge of calculus and linear algebra is required.","[{'type': 'ISBN_13', 'identifier': '9783662678824'}, {'type': 'ISBN_10', 'identifier': '3662678829'}]",False,True,372,BOOK,['Computers'],NOT_MATURE,False,0.1.0.0.preview.1,False,False,http://books.google.com/books/content?id=FpLUEAAAQBAJ&printsec=frontcover&img=1&zoom=5&edge=curl&source=gbs_api,http://books.google.com/books/content?id=FpLUEAAAQBAJ&printsec=frontcover&img=1&zoom=1&edge=curl&source=gbs_api,en,http://books.google.fr/books?id=FpLUEAAAQBAJ&printsec=frontcover&dq=data+science&hl=&as_brr=6&cd=14&source=gbs_api,https://play.google.com/store/books/details?id=FpLUEAAAQBAJ&source=gbs_api,https://play.google.com/store/books/details?id=FpLUEAAAQBAJ,FR,FOR_SALE,True,58.01,EUR,37.71,EUR,https://play.google.com/store/books/details?id=FpLUEAAAQBAJ&rdid=book-FpLUEAAAQBAJ&rdot=1&source=gbs_api,"[{'finskyOfferType': 1, 'listPrice': {'amountInMicros': 58010000, 'currencyCode': 'EUR'}, 'retailPrice': {'amountInMicros': 37710000, 'currencyCode': 'EUR'}, 'giftable': True}]",FR,PARTIAL,True,False,ALLOWED,False,,True,http://books.google.fr/books/download/Data_Science-sample-pdf.acsm?id=FpLUEAAAQBAJ&format=pdf&output=acs4_fulfillment_token&dl_type=sample&source=gbs_api,http://play.google.com/books/reader?id=FpLUEAAAQBAJ&hl=&as_brr=6&source=gbs_api,SAMPLE,False,"This book is suitable for professionals, students, and instructors who want to master the theory of data science and explore its applications across various domains.",,
14,books#volume,M4wuEQAAQBAJ,imU8yJVzK4A,https://www.googleapis.com/books/v1/volumes/M4wuEQAAQBAJ,The Data Science Handbook,,['Field Cady'],John Wiley & Sons,2024-10-31,"Practical, accessible guide to becoming a data scientist, updated to include the latest advances in data science and related fields. Becoming a data scientist is hard. The job focuses on mathematical tools, but also demands fluency with software engineering, understanding of a business situation, and deep understanding of the data itself. This book provides a crash course in data science, combining all the necessary skills into a unified discipline. The focus of The Data Science Handbook is on practical applications and the ability to solve real problems, rather than theoretical formalisms that are rarely needed in practice. Among its key points are: An emphasis on software engineering and coding skills, which play a significant role in most real data science problems. Extensive sample code, detailed discussions of important libraries, and a solid grounding in core concepts from computer science (computer architecture, runtime complexity, and programming paradigms). A broad overview of important mathematical tools, including classical techniques in statistics, stochastic modeling, regression, numerical optimization, and more. Extensive tips about the practical realities of working as a data scientist, including understanding related jobs functions, project life cycles, and the varying roles of data science in an organization. Exactly the right amount of theory. A solid conceptual foundation is required for fitting the right model to a business problem, understanding a tool’s limitations, and reasoning about discoveries. Data science is a quickly evolving field, and this 2nd edition has been updated to reflect the latest developments, including the revolution in AI that has come from Large Language Models and the growth of ML Engineering as its own discipline. Much of data science has become a skillset that anybody can have, making this book not only for aspiring data scientists, but also for professionals in other fields who want to use analytics as a force multiplier in their organization.","[{'type': 'ISBN_13', 'identifier': '9781394234509'}, {'type': 'ISBN_10', 'identifier': '1394234503'}]",True,True,374,BOOK,['Computers'],NOT_MATURE,False,preview-1.0.0,False,False,http://books.google.com/books/content?id=M4wuEQAAQBAJ&printsec=frontcover&img=1&zoom=5&edge=curl&source=gbs_api,http://books.google.com/books/content?id=M4wuEQAAQBAJ&printsec=frontcover&img=1&zoom=1&edge=curl&source=gbs_api,en,http://books.google.fr/books?id=M4wuEQAAQBAJ&pg=PP1&dq=data+science&hl=&as_brr=6&cd=15&source=gbs_api,https://play.google.com/store/books/details?id=M4wuEQAAQBAJ&source=gbs_api,https://play.google.com/store/books/details?id=M4wuEQAAQBAJ,FR,FOR_SALE,True,64.99,EUR,64.99,EUR,https://play.google.com/store/books/details?id=M4wuEQAAQBAJ&rdid=book-M4wuEQAAQBAJ&rdot=1&source=gbs_api,"[{'finskyOfferType': 1, 'listPrice': {'amountInMicros': 64990000, 'currencyCode': 'EUR'}, 'retailPrice': {'amountInMicros': 64990000, 'currencyCode': 'EUR'}, 'giftable': True}]",FR,PARTIAL,True,False,ALLOWED,True,http://books.google.fr/books/download/The_Data_Science_Handbook-sample-epub.acsm?id=M4wuEQAAQBAJ&format=epub&output=acs4_fulfillment_token&dl_type=sample&source=gbs_api,True,http://books.google.fr/books/download/The_Data_Science_Handbook-sample-pdf.acsm?id=M4wuEQAAQBAJ&format=pdf&output=acs4_fulfillment_token&dl_type=sample&source=gbs_api,http://play.google.com/books/reader?id=M4wuEQAAQBAJ&hl=&as_brr=6&source=gbs_api,SAMPLE,False,"This book provides a crash course in data science, combining all the necessary skills into a unified discipline.",,
15,books#volume,pBdnDwAAQBAJ,4pcBSxNiovg,https://www.googleapis.com/books/v1/volumes/pBdnDwAAQBAJ,Data Science and Big Data Analytics,ACM-WIR 2018,"['Durgesh Kumar Mishra', 'Xin-She Yang', 'Aynur Unal']",Springer,2018-08-01,"This book presents conjectural advances in big data analysis, machine learning and computational intelligence, as well as their potential applications in scientific computing. It discusses major issues pertaining to big data analysis using computational intelligence techniques, and the conjectural elements are supported by simulation and modelling applications to help address real-world problems. An extensive bibliography is provided at the end of each chapter. Further, the main content is supplemented by a wealth of figures, graphs, and tables, offering a valuable guide for researchers in the field of big data analytics and computational intelligence.","[{'type': 'ISBN_13', 'identifier': '9789811076411'}, {'type': 'ISBN_10', 'identifier': '9811076413'}]",True,True,418,BOOK,['Technology & Engineering'],NOT_MATURE,False,1.2.3.0.preview.3,False,False,http://books.google.com/books/content?id=pBdnDwAAQBAJ&printsec=frontcover&img=1&zoom=5&edge=curl&source=gbs_api,http://books.google.com/books/content?id=pBdnDwAAQBAJ&printsec=frontcover&img=1&zoom=1&edge=curl&source=gbs_api,en,http://books.google.fr/books?id=pBdnDwAAQBAJ&printsec=frontcover&dq=data+science&hl=&as_brr=6&cd=16&source=gbs_api,https://play.google.com/store/books/details?id=pBdnDwAAQBAJ&source=gbs_api,https://play.google.com/store/books/details?id=pBdnDwAAQBAJ,FR,FOR_SALE,True,147.69,EUR,103.38,EUR,https://play.google.com/store/books/details?id=pBdnDwAAQBAJ&rdid=book-pBdnDwAAQBAJ&rdot=1&source=gbs_api,"[{'finskyOfferType': 1, 'listPrice': {'amountInMicros': 147690000, 'currencyCode': 'EUR'}, 'retailPrice': {'amountInMicros': 103380000, 'currencyCode': 'EUR'}, 'giftable': True}]",FR,PARTIAL,True,False,ALLOWED,True,http://books.google.fr/books/download/Data_Science_and_Big_Data_Analytics-sample-epub.acsm?id=pBdnDwAAQBAJ&format=epub&output=acs4_fulfillment_token&dl_type=sample&source=gbs_api,True,http://books.google.fr/books/download/Data_Science_and_Big_Data_Analytics-sample-pdf.acsm?id=pBdnDwAAQBAJ&format=pdf&output=acs4_fulfillment_token&dl_type=sample&source=gbs_api,http://play.google.com/books/reader?id=pBdnDwAAQBAJ&hl=&as_brr=6&source=gbs_api,SAMPLE,False,"This book presents conjectural advances in big data analysis, machine learning and computational intelligence, as well as their potential applications in scientific computing.",,
16,books#volume,jcO2DwAAQBAJ,PfsGroXnFPk,https://www.googleapis.com/books/v1/volumes/jcO2DwAAQBAJ,Data Science,"Theory, Analysis and Applications","['Qurban A Memon', 'Shakeel Ahmed Khoja']",CRC Press,2019-09-26,"The aim of this book is to provide an internationally respected collection of scientific research methods, technologies and applications in the area of data science. This book can prove useful to the researchers, professors, research students and practitioners as it reports novel research work on challenging topics in the area surrounding data science. In this book, some of the chapters are written in tutorial style concerning machine learning algorithms, data analysis, information design, infographics, relevant applications, etc. The book is structured as follows: • Part I: Data Science: Theory, Concepts, and Algorithms This part comprises five chapters on data Science theory, concepts, techniques and algorithms. • Part II: Data Design and Analysis This part comprises five chapters on data design and analysis. • Part III: Applications and New Trends in Data Science This part comprises four chapters on applications and new trends in data science.","[{'type': 'ISBN_13', 'identifier': '9780429554353'}, {'type': 'ISBN_10', 'identifier': '0429554354'}]",False,True,345,BOOK,['Computers'],NOT_MATURE,False,0.2.3.0.preview.1,False,False,http://books.google.com/books/content?id=jcO2DwAAQBAJ&printsec=frontcover&img=1&zoom=5&edge=curl&source=gbs_api,http://books.google.com/books/content?id=jcO2DwAAQBAJ&printsec=frontcover&img=1&zoom=1&edge=curl&source=gbs_api,en,http://books.google.fr/books?id=jcO2DwAAQBAJ&printsec=frontcover&dq=data+science&hl=&as_brr=6&cd=17&source=gbs_api,https://play.google.com/store/books/details?id=jcO2DwAAQBAJ&source=gbs_api,https://play.google.com/store/books/details?id=jcO2DwAAQBAJ,FR,FOR_SALE,True,67.51,EUR,50.84,EUR,https://play.google.com/store/books/details?id=jcO2DwAAQBAJ&rdid=book-jcO2DwAAQBAJ&rdot=1&source=gbs_api,"[{'finskyOfferType': 1, 'listPrice': {'amountInMicros': 67510000, 'currencyCode': 'EUR'}, 'retailPrice': {'amountInMicros': 50840000, 'currencyCode': 'EUR'}, 'giftable': True}]",FR,PARTIAL,True,False,ALLOWED,False,,True,http://books.google.fr/books/download/Data_Science-sample-pdf.acsm?id=jcO2DwAAQBAJ&format=pdf&output=acs4_fulfillment_token&dl_type=sample&source=gbs_api,http://play.google.com/books/reader?id=jcO2DwAAQBAJ&hl=&as_brr=6&source=gbs_api,SAMPLE,False,"The aim of this book is to provide an internationally respected collection of scientific research methods, technologies and applications in the area of data science.",,
17,books#volume,kYZZEAAAQBAJ,n+mvKnbOUY4,https://www.googleapis.com/books/v1/volumes/kYZZEAAAQBAJ,Practitioner’s Guide to Data Science,"Streamlining Data Science Solutions using Python, Scikit-Learn, and Azure ML Service Platform (English Edition)",['Nasir Ali Mirza'],BPB Publications,2022-01-17,"Covers Data Science concepts, processes, and the real-world hands-on use cases. KEY FEATURES ● Covers the journey from a basic programmer to an effective Data Science developer. ● Applied use of Data Science native processes like CRISP-DM and Microsoft TDSP. ● Implementation of MLOps using Microsoft Azure DevOps. DESCRIPTION ""How is the Data Science project to be implemented?"" has never been more conceptually sounding, thanks to the work presented in this book. This book provides an in-depth look at the current state of the world's data and how Data Science plays a pivotal role in everything we do. This book explains and implements the entire Data Science lifecycle using well-known data science processes like CRISP-DM and Microsoft TDSP. The book explains the significance of these processes in connection with the high failure rate of Data Science projects. The book helps build a solid foundation in Data Science concepts and related frameworks. It teaches how to implement real-world use cases using data from the HMDA dataset. It explains Azure ML Service architecture, its capabilities, and implementation to the DS team, who will then be prepared to implement MLOps. The book also explains how to use Azure DevOps to make the process repeatable while we're at it. By the end of this book, you will learn strong Python coding skills, gain a firm grasp of concepts such as feature engineering, create insightful visualizations and become acquainted with techniques for building machine learning models. WHAT YOU WILL LEARN ● Organize Data Science projects using CRISP-DM and Microsoft TDSP. ● Learn to acquire and explore data using Python visualizations. ● Get well versed with the implementation of data pre-processing and Feature Engineering. ● Understand algorithm selection, model development, and model evaluation. ● Hands-on with Azure ML Service, its architecture, and capabilities. ● Learn to use Azure ML SDK and MLOps for implementing real-world use cases. WHO THIS BOOK IS FOR This book is intended for programmers who wish to pursue AI/ML development and build a solid conceptual foundation and familiarity with related processes and frameworks. Additionally, this book is an excellent resource for Software Architects and Managers involved in the design and delivery of Data Science-based solutions. TABLE OF CONTENTS 1. Data Science for Business 2. Data Science Project Methodologies and Team Processes 3. Business Understanding and Its Data Landscape 4. Acquire, Explore, and Analyze Data 5. Pre-processing and Preparing Data 6. Developing a Machine Learning Model 7. Lap Around Azure ML Service 8. Deploying and Managing Models","[{'type': 'ISBN_13', 'identifier': '9789391392871'}, {'type': 'ISBN_10', 'identifier': '9391392873'}]",True,True,275,BOOK,['Computers'],NOT_MATURE,False,0.1.1.0.preview.3,False,False,http://books.google.com/books/content?id=kYZZEAAAQBAJ&printsec=frontcover&img=1&zoom=5&edge=curl&source=gbs_api,http://books.google.com/books/content?id=kYZZEAAAQBAJ&printsec=frontcover&img=1&zoom=1&edge=curl&source=gbs_api,en,http://books.google.fr/books?id=kYZZEAAAQBAJ&printsec=frontcover&dq=data+science&hl=&as_brr=6&cd=18&source=gbs_api,https://play.google.com/store/books/details?id=kYZZEAAAQBAJ&source=gbs_api,https://play.google.com/store/books/details?id=kYZZEAAAQBAJ,FR,FOR_SALE,True,8.91,EUR,8.91,EUR,https://play.google.com/store/books/details?id=kYZZEAAAQBAJ&rdid=book-kYZZEAAAQBAJ&rdot=1&source=gbs_api,"[{'finskyOfferType': 1, 'listPrice': {'amountInMicros': 8910000, 'currencyCode': 'EUR'}, 'retailPrice': {'amountInMicros': 8910000, 'currencyCode': 'EUR'}, 'giftable': True}]",FR,PARTIAL,True,False,ALLOWED,True,http://books.google.fr/books/download/Practitioner_s_Guide_to_Data_Science-sample-epub.acsm?id=kYZZEAAAQBAJ&format=epub&output=acs4_fulfillment_token&dl_type=sample&source=gbs_api,True,http://books.google.fr/books/download/Practitioner_s_Guide_to_Data_Science-sample-pdf.acsm?id=kYZZEAAAQBAJ&format=pdf&output=acs4_fulfillment_token&dl_type=sample&source=gbs_api,http://play.google.com/books/reader?id=kYZZEAAAQBAJ&hl=&as_brr=6&source=gbs_api,SAMPLE,False,The book explains the significance of these processes in connection with the high failure rate of Data Science projects. The book helps build a solid foundation in Data Science concepts and related frameworks.,,
18,books#volume,cT1CEQAAQBAJ,SII/6zEmsGA,https://www.googleapis.com/books/v1/volumes/cT1CEQAAQBAJ,"Data Science and Big Data: Foundations, Tools, and Techniques",,,Addition Publishing House,2024-12-02,"The world is increasingly driven by data, and as businesses and individuals generate more information than ever before, the demand for professionals skilled in data science and big data technologies continues to rise. Introduction to Data Science and Big Data aims to provide readers with a comprehensive understanding of these cutting-edge fields and the tools needed to navigate and make sense of vast amounts of data. This book covers the foundational concepts of data science and big data, including data collection, cleaning, and analysis. It dives into key data science methodologies, such as machine learning, statistical analysis, and predictive modeling. The book also explores big data technologies like Hadoop, Spark, and cloud computing, emphasizing how they can handle and process large datasets efficiently. Designed for students, professionals, and enthusiasts, this book presents complex topics in a clear and approachable manner. Each chapter is equipped with practical examples and real-world case studies to illustrate how data science and big data techniques are applied in various industries. By the end of this book, readers will have a solid understanding of how to leverage data for decision-making and problem-solving. As we stand on the precipice of a data-driven world, understanding how to manipulate and derive insights from vast amounts of data is no longer optional. With this book, readers will gain the skills necessary to thrive in the fast-evolving field of data science and big data, equipping them for success in the 21st century.","[{'type': 'ISBN_13', 'identifier': '9789364226134'}, {'type': 'ISBN_10', 'identifier': '9364226135'}]",False,True,216,BOOK,['Antiques & Collectibles'],NOT_MATURE,False,0.0.1.0.preview.1,False,False,http://books.google.com/books/content?id=cT1CEQAAQBAJ&printsec=frontcover&img=1&zoom=5&edge=curl&source=gbs_api,http://books.google.com/books/content?id=cT1CEQAAQBAJ&printsec=frontcover&img=1&zoom=1&edge=curl&source=gbs_api,en,http://books.google.fr/books?id=cT1CEQAAQBAJ&printsec=frontcover&dq=data+science&hl=&as_brr=6&cd=19&source=gbs_api,https://play.google.com/store/books/details?id=cT1CEQAAQBAJ&source=gbs_api,https://play.google.com/store/books/details?id=cT1CEQAAQBAJ,FR,FOR_SALE,True,7.31,EUR,7.31,EUR,https://play.google.com/store/books/details?id=cT1CEQAAQBAJ&rdid=book-cT1CEQAAQBAJ&rdot=1&source=gbs_api,"[{'finskyOfferType': 1, 'listPrice': {'amountInMicros': 7310000, 'currencyCode': 'EUR'}, 'retailPrice': {'amountInMicros': 7310000, 'currencyCode': 'EUR'}, 'giftable': True}]",FR,PARTIAL,True,False,ALLOWED,False,,True,http://books.google.fr/books/download/Data_Science_and_Big_Data_Foundations_To-sample-pdf.acsm?id=cT1CEQAAQBAJ&format=pdf&output=acs4_fulfillment_token&dl_type=sample&source=gbs_api,http://play.google.com/books/reader?id=cT1CEQAAQBAJ&hl=&as_brr=6&source=gbs_api,SAMPLE,False,"With this book, readers will gain the skills necessary to thrive in the fast-evolving field of data science and big data, equipping them for success in the 21st century.",,
19,books#volume,wAxIEAAAQBAJ,YH2/BBd7bds,https://www.googleapis.com/books/v1/volumes/wAxIEAAAQBAJ,Fundamentals of Data Science,,"['Sanjeev J. Wagh', 'Manisha S. Bhende', 'Anuradha D. Thakare']",CRC Press,2021-09-26,"Fundamentals of Data Science is designed for students, academicians and practitioners with a complete walkthrough right from the foundational groundwork required to outlining all the concepts, techniques and tools required to understand Data Science. Data Science is an umbrella term for the non-traditional techniques and technologies that are required to collect, aggregate, process, and gain insights from massive datasets. This book offers all the processes, methodologies, various steps like data acquisition, pre-process, mining, prediction, and visualization tools for extracting insights from vast amounts of data by the use of various scientific methods, algorithms, and processes Readers will learn the steps necessary to create the application with SQl, NoSQL, Python, R, Matlab, Octave and Tablue. This book provides a stepwise approach to building solutions to data science applications right from understanding the fundamentals, performing data analytics to writing source code. All the concepts are discussed in simple English to help the community to become Data Scientist without much pre-requisite knowledge. Features : Simple strategies for developing statistical models that analyze data and detect patterns, trends, and relationships in data sets. Complete roadmap to Data Science approach with dedicatedsections which includes Fundamentals, Methodology and Tools. Focussed approach for learning and practice various Data Science Toolswith Sample code and examples for practice. Information is presented in an accessible way for students, researchers and academicians and professionals.","[{'type': 'ISBN_13', 'identifier': '9780429811470'}, {'type': 'ISBN_10', 'identifier': '0429811470'}]",False,True,297,BOOK,['Business & Economics'],NOT_MATURE,False,0.2.2.0.preview.1,False,False,http://books.google.com/books/content?id=wAxIEAAAQBAJ&printsec=frontcover&img=1&zoom=5&edge=curl&source=gbs_api,http://books.google.com/books/content?id=wAxIEAAAQBAJ&printsec=frontcover&img=1&zoom=1&edge=curl&source=gbs_api,en,http://books.google.fr/books?id=wAxIEAAAQBAJ&printsec=frontcover&dq=data+science&hl=&as_brr=6&cd=20&source=gbs_api,https://play.google.com/store/books/details?id=wAxIEAAAQBAJ&source=gbs_api,https://play.google.com/store/books/details?id=wAxIEAAAQBAJ,FR,FOR_SALE,True,61.18,EUR,45.78,EUR,https://play.google.com/store/books/details?id=wAxIEAAAQBAJ&rdid=book-wAxIEAAAQBAJ&rdot=1&source=gbs_api,"[{'finskyOfferType': 1, 'listPrice': {'amountInMicros': 61180000, 'currencyCode': 'EUR'}, 'retailPrice': {'amountInMicros': 45780000, 'currencyCode': 'EUR'}, 'giftable': True}]",FR,PARTIAL,True,False,ALLOWED,False,,True,http://books.google.fr/books/download/Fundamentals_of_Data_Science-sample-pdf.acsm?id=wAxIEAAAQBAJ&format=pdf&output=acs4_fulfillment_token&dl_type=sample&source=gbs_api,http://play.google.com/books/reader?id=wAxIEAAAQBAJ&hl=&as_brr=6&source=gbs_api,SAMPLE,False,"This book provides a stepwise approach to building solutions to data science applications right from understanding the fundamentals, performing data analytics to writing source code.",,
