6,books#volume,RKvoDwAAQBAJ,POafeY25yeM,https://www.googleapis.com/books/v1/volumes/RKvoDwAAQBAJ,Data Science Fundamentals and Practical Approaches,Understand Why Data Science Is the Next,"['Dr. Gypsy Nandi', 'Dr. Rupam Kumar Sharma']",BPB Publications,2020-06-02,"Learn how to process and analysis data using PythonÊ KEY FEATURESÊ - The book has theories explained elaborately along with Python code and corresponding output to support the theoretical explanations. The Python codes are provided with step-by-step comments to explain each instruction of the code. - The book is not just dealing with the background mathematics alone or only the programs but beautifully correlates the background mathematics to the theory and then finally translating it into the programs. - A rich set of chapter-end exercises are provided, consisting of both short-answer questions and long-answer questions. DESCRIPTION This book introduces the fundamental concepts of Data Science, which has proved to be a major game-changer in business solving problems.Ê Topics covered in the book include fundamentals of Data Science, data preprocessing, data plotting and visualization, statistical data analysis, machine learning for data analysis, time-series analysis, deep learning for Data Science, social media analytics, business analytics, and Big Data analytics. The content of the book describes the fundamentals of each of the Data Science related topics together with illustrative examples as to how various data analysis techniques can be implemented using different tools and libraries of Python programming language. Each chapter contains numerous examples and illustrative output to explain the important basic concepts. An appropriate number of questions is presented at the end of each chapter for self-assessing the conceptual understanding. The references presented at the end of every chapter will help the readers to explore more on a given topic.Ê WHAT WILL YOU LEARNÊ Perform processing on data for making it ready for visual plot and understand the pattern in data over time. Understand what machine learning is and how learning can be incorporated into a program. Know how tools can be used to perform analysis on big data using python and other standard tools. Perform social media analytics, business analytics, and data analytics on any data of a company or organization. WHO THIS BOOK IS FOR The book is for readers with basic programming and mathematical skills. The book is for any engineering graduates that wish to apply data science in their projects or wish to build a career in this direction. The book can be read by anyone who has an interest in data analysis and would like to explore more out of interest or to apply it to certain real-life problems. TABLE OF CONTENTS 1. Fundamentals of Data Science1 2. Data Preprocessing 3. Data Plotting and Visualization 4. Statistical Data Analysis 5. Machine Learning for Data Science 6. Time-Series Analysis 7. Deep Learning for Data Science 8. Social Media Analytics 9. Business Analytics 10. Big Data Analytics","[{'type': 'ISBN_13', 'identifier': '9789389845662'}, {'type': 'ISBN_10', 'identifier': '9389845661'}]",True,True,587,BOOK,['Computers'],NOT_MATURE,True,1.4.4.0.preview.3,False,False,http://books.google.com/books/content?id=RKvoDwAAQBAJ&printsec=frontcover&img=1&zoom=5&edge=curl&source=gbs_api,http://books.google.com/books/content?id=RKvoDwAAQBAJ&printsec=frontcover&img=1&zoom=1&edge=curl&source=gbs_api,en,http://books.google.fr/books?id=RKvoDwAAQBAJ&printsec=frontcover&dq=data+science&hl=&as_brr=6&cd=7&source=gbs_api,https://play.google.com/store/books/details?id=RKvoDwAAQBAJ&source=gbs_api,https://play.google.com/store/books/details?id=RKvoDwAAQBAJ,FR,FOR_SALE,True,8.91,EUR,8.91,EUR,https://play.google.com/store/books/details?id=RKvoDwAAQBAJ&rdid=book-RKvoDwAAQBAJ&rdot=1&source=gbs_api,"[{'finskyOfferType': 1, 'listPrice': {'amountInMicros': 8910000, 'currencyCode': 'EUR'}, 'retailPrice': {'amountInMicros': 8910000, 'currencyCode': 'EUR'}, 'giftable': True}]",FR,PARTIAL,True,False,ALLOWED,True,http://books.google.fr/books/download/Data_Science_Fundamentals_and_Practical-sample-epub.acsm?id=RKvoDwAAQBAJ&format=epub&output=acs4_fulfillment_token&dl_type=sample&source=gbs_api,True,http://books.google.fr/books/download/Data_Science_Fundamentals_and_Practical-sample-pdf.acsm?id=RKvoDwAAQBAJ&format=pdf&output=acs4_fulfillment_token&dl_type=sample&source=gbs_api,http://play.google.com/books/reader?id=RKvoDwAAQBAJ&hl=&as_brr=6&source=gbs_api,SAMPLE,False,WHO THIS BOOK IS FOR The book is for readers with basic programming and mathematical skills. The book is for any engineering graduates that wish to apply data science in their projects or wish to build a career in this direction.,5.0,1.0
7,books#volume,Eb9IEAAAQBAJ,tbSCsIvsTdA,https://www.googleapis.com/books/v1/volumes/Eb9IEAAAQBAJ,Data Science Fundamentals and Practical Approaches,,"['Nandi Dr. Rupam Dr. Gypsy, Kumar Sharma']",BPB Publications,2020-09-03,"Learn how to process and analysis data using Python Key Features a- The book has theories explained elaborately along with Python code and corresponding output to support the theoretical explanations. The Python codes are provided with step-by-step comments to explain each instruction of the code. a- The book is quite well balanced with programs and illustrative real-case problems. a- The book not only deals with the background mathematics alone or only the programs but also beautifully correlates the background mathematics to the theory and then finally translating it into the programs. a- A rich set of chapter-end exercises are provided, consisting of both short-answer questions and long-answer questions. Description This book introduces the fundamental concepts of Data Science, which has proved to be a major game-changer in business solving problems. Topics covered in the book include fundamentals of Data Science, data preprocessing, data plotting and visualization, statistical data analysis, machine learning for data analysis, time-series analysis, deep learning for Data Science, social media analytics, business analytics, and Big Data analytics. The content of the book describes the fundamentals of each of the Data Science related topics together with illustrative examples as to how various data analysis techniques can be implemented using different tools and libraries of Python programming language. Each chapter contains numerous examples and illustrative output to explain the important basic concepts. An appropriate number of questions is presented at the end of each chapter for self-assessing the conceptual understanding. The references presented at the end of every chapter will help the readers to explore more on a given topic. What will you learn a- Understand what machine learning is and how learning can be incorporated into a program. a- Perform data processing to make it ready for visual plot to understand the pattern in data over time. a- Know how tools can be used to perform analysis on big data using python a- Perform social media analytics, business analytics, and data analytics on any data of a company or organization. Who this book is for The book is for readers with basic programming and mathematical skills. The book is for any engineering graduates that wish to apply data science in their projects or wish to build a career in this direction. The book can be read by anyone who has an interest in data analysis and would like to explore more out of interest or to apply it to certain real-life problems. Table of Contents 1. Fundamentals of Data Science1 2. Data Preprocessing 3. Data Plotting and Visualization 4. Statistical Data Analysis 5. Machine Learning for Data Science 6. Time-Series Analysis 7. Deep Learning for Data Science 8. Social Media Analytics 9. Business Analytics 10. Big Data Analytics About the Authors Dr. Gypsy Nandi is an Assistant Professor (Sr) in the Department of Computer Applications, Assam Don Bosco University, India. Her areas of interest include Data Science, Social Network Mining, and Machine Learning. She has completed her Ph.D. in the field of 'Social Network Analysis and Mining'. Her research scholars are currently working mainly in the field of Data Science. She has several research publications in reputed journals and book series. Dr. Rupam Kumar Sharma is an Assistant Professor in the Department of Computer Applications, Assam Don Bosco University, India. His area of interest includes Machine Learning, Data Analytics, Network, and Cyber Security. He has several research publications in reputed SCI and Scopus journals. He has also delivered lectures and trained hundreds of trainees and students across different institutes in the field of security and android app development.","[{'type': 'ISBN_13', 'identifier': '9789389845679'}, {'type': 'ISBN_10', 'identifier': '938984567X'}]",True,True,586,BOOK,['Language Arts & Disciplines'],NOT_MATURE,False,0.1.1.0.preview.3,False,False,http://books.google.com/books/content?id=Eb9IEAAAQBAJ&printsec=frontcover&img=1&zoom=5&edge=curl&source=gbs_api,http://books.google.com/books/content?id=Eb9IEAAAQBAJ&printsec=frontcover&img=1&zoom=1&edge=curl&source=gbs_api,en,http://books.google.fr/books?id=Eb9IEAAAQBAJ&printsec=frontcover&dq=data+science&hl=&as_brr=6&cd=8&source=gbs_api,https://play.google.com/store/books/details?id=Eb9IEAAAQBAJ&source=gbs_api,https://play.google.com/store/books/details?id=Eb9IEAAAQBAJ,FR,FOR_SALE,True,8.91,EUR,8.91,EUR,https://play.google.com/store/books/details?id=Eb9IEAAAQBAJ&rdid=book-Eb9IEAAAQBAJ&rdot=1&source=gbs_api,"[{'finskyOfferType': 1, 'listPrice': {'amountInMicros': 8910000, 'currencyCode': 'EUR'}, 'retailPrice': {'amountInMicros': 8910000, 'currencyCode': 'EUR'}, 'giftable': True}]",FR,PARTIAL,True,False,ALLOWED,True,http://books.google.fr/books/download/Data_Science_Fundamentals_and_Practical-sample-epub.acsm?id=Eb9IEAAAQBAJ&format=epub&output=acs4_fulfillment_token&dl_type=sample&source=gbs_api,True,http://books.google.fr/books/download/Data_Science_Fundamentals_and_Practical-sample-pdf.acsm?id=Eb9IEAAAQBAJ&format=pdf&output=acs4_fulfillment_token&dl_type=sample&source=gbs_api,http://play.google.com/books/reader?id=Eb9IEAAAQBAJ&hl=&as_brr=6&source=gbs_api,SAMPLE,False,Who this book is for The book is for readers with basic programming and mathematical skills. The book is for any engineering graduates that wish to apply data science in their projects or wish to build a career in this direction.,,
8,books#volume,UlpVDwAAQBAJ,li4SEuOmPrU,https://www.googleapis.com/books/v1/volumes/UlpVDwAAQBAJ,Data Science,,"['John D. Kelleher', 'Brendan Tierney']",MIT Press,2018-04-13,"A concise introduction to the emerging field of data science, explaining its evolution, relation to machine learning, current uses, data infrastructure issues, and ethical challenges. The goal of data science is to improve decision making through the analysis of data. Today data science determines the ads we see online, the books and movies that are recommended to us online, which emails are filtered into our spam folders, and even how much we pay for health insurance. This volume in the MIT Press Essential Knowledge series offers a concise introduction to the emerging field of data science, explaining its evolution, current uses, data infrastructure issues, and ethical challenges. It has never been easier for organizations to gather, store, and process data. Use of data science is driven by the rise of big data and social media, the development of high-performance computing, and the emergence of such powerful methods for data analysis and modeling as deep learning. Data science encompasses a set of principles, problem definitions, algorithms, and processes for extracting non-obvious and useful patterns from large datasets. It is closely related to the fields of data mining and machine learning, but broader in scope. This book offers a brief history of the field, introduces fundamental data concepts, and describes the stages in a data science project. It considers data infrastructure and the challenges posed by integrating data from multiple sources, introduces the basics of machine learning, and discusses how to link machine learning expertise with real-world problems. The book also reviews ethical and legal issues, developments in data regulation, and computational approaches to preserving privacy. Finally, it considers the future impact of data science and offers principles for success in data science projects.","[{'type': 'ISBN_13', 'identifier': '9780262347037'}, {'type': 'ISBN_10', 'identifier': '0262347032'}]",True,True,282,BOOK,['Computers'],NOT_MATURE,True,1.3.3.0.preview.3,False,False,http://books.google.com/books/content?id=UlpVDwAAQBAJ&printsec=frontcover&img=1&zoom=5&edge=curl&source=gbs_api,http://books.google.com/books/content?id=UlpVDwAAQBAJ&printsec=frontcover&img=1&zoom=1&edge=curl&source=gbs_api,en,http://books.google.fr/books?id=UlpVDwAAQBAJ&printsec=frontcover&dq=data+science&hl=&as_brr=6&cd=9&source=gbs_api,https://play.google.com/store/books/details?id=UlpVDwAAQBAJ&source=gbs_api,https://play.google.com/store/books/details?id=UlpVDwAAQBAJ,FR,FOR_SALE,True,15.32,EUR,15.32,EUR,https://play.google.com/store/books/details?id=UlpVDwAAQBAJ&rdid=book-UlpVDwAAQBAJ&rdot=1&source=gbs_api,"[{'finskyOfferType': 1, 'listPrice': {'amountInMicros': 15320000, 'currencyCode': 'EUR'}, 'retailPrice': {'amountInMicros': 15320000, 'currencyCode': 'EUR'}, 'giftable': True}]",FR,PARTIAL,True,False,ALLOWED,True,http://books.google.fr/books/download/Data_Science-sample-epub.acsm?id=UlpVDwAAQBAJ&format=epub&output=acs4_fulfillment_token&dl_type=sample&source=gbs_api,True,http://books.google.fr/books/download/Data_Science-sample-pdf.acsm?id=UlpVDwAAQBAJ&format=pdf&output=acs4_fulfillment_token&dl_type=sample&source=gbs_api,http://play.google.com/books/reader?id=UlpVDwAAQBAJ&hl=&as_brr=6&source=gbs_api,SAMPLE,False,"This volume in the MIT Press Essential Knowledge series offers a concise introduction to the emerging field of data science, explaining its evolution, current uses, data infrastructure issues, and ethical challenges.",,
9,books#volume,jyMuEAAAQBAJ,wg+iH2HXP+M,https://www.googleapis.com/books/v1/volumes/jyMuEAAAQBAJ,Human-Centered Data Science,An Introduction,"['Cecilia Aragon', 'Shion Guha', 'Marina Kogan', 'Michael Muller', 'Gina Neff']",MIT Press,2022-03-01,"Best practices for addressing the bias and inequality that may result from the automated collection, analysis, and distribution of large datasets. Human-centered data science is a new interdisciplinary field that draws from human-computer interaction, social science, statistics, and computational techniques. This book, written by founders of the field, introduces best practices for addressing the bias and inequality that may result from the automated collection, analysis, and distribution of very large datasets. It offers a brief and accessible overview of many common statistical and algorithmic data science techniques, explains human-centered approaches to data science problems, and presents practical guidelines and real-world case studies to help readers apply these methods. The authors explain how data scientists’ choices are involved at every stage of the data science workflow—and show how a human-centered approach can enhance each one, by making the process more transparent, asking questions, and considering the social context of the data. They describe how tools from social science might be incorporated into data science practices, discuss different types of collaboration, and consider data storytelling through visualization. The book shows that data science practitioners can build rigorous and ethical algorithms and design projects that use cutting-edge computational tools and address social concerns.","[{'type': 'ISBN_13', 'identifier': '9780262367592'}, {'type': 'ISBN_10', 'identifier': '0262367599'}]",True,True,201,BOOK,['Computers'],NOT_MATURE,False,1.2.2.0.preview.3,False,False,http://books.google.com/books/content?id=jyMuEAAAQBAJ&printsec=frontcover&img=1&zoom=5&edge=curl&source=gbs_api,http://books.google.com/books/content?id=jyMuEAAAQBAJ&printsec=frontcover&img=1&zoom=1&edge=curl&source=gbs_api,en,http://books.google.fr/books?id=jyMuEAAAQBAJ&printsec=frontcover&dq=data+science&hl=&as_brr=6&cd=10&source=gbs_api,https://play.google.com/store/books/details?id=jyMuEAAAQBAJ&source=gbs_api,https://play.google.com/store/books/details?id=jyMuEAAAQBAJ,FR,FOR_SALE,True,27.93,EUR,27.93,EUR,https://play.google.com/store/books/details?id=jyMuEAAAQBAJ&rdid=book-jyMuEAAAQBAJ&rdot=1&source=gbs_api,"[{'finskyOfferType': 1, 'listPrice': {'amountInMicros': 27930000, 'currencyCode': 'EUR'}, 'retailPrice': {'amountInMicros': 27930000, 'currencyCode': 'EUR'}, 'giftable': True}]",FR,PARTIAL,True,False,ALLOWED,True,http://books.google.fr/books/download/Human_Centered_Data_Science-sample-epub.acsm?id=jyMuEAAAQBAJ&format=epub&output=acs4_fulfillment_token&dl_type=sample&source=gbs_api,True,http://books.google.fr/books/download/Human_Centered_Data_Science-sample-pdf.acsm?id=jyMuEAAAQBAJ&format=pdf&output=acs4_fulfillment_token&dl_type=sample&source=gbs_api,http://play.google.com/books/reader?id=jyMuEAAAQBAJ&hl=&as_brr=6&source=gbs_api,SAMPLE,False,"This book, written by founders of the field, introduces best practices for addressing the bias and inequality that may result from the automated collection, analysis, and distribution of very large datasets.",,
10,books#volume,7vW4CgAAQBAJ,Tga4GMnor7o,https://www.googleapis.com/books/v1/volumes/7vW4CgAAQBAJ,Data Science : fondamentaux et études de cas,Machine Learning avec Python et R,"['Michel Lutz', 'Eric Biernat']",Editions Eyrolles,2015-10-15,"Nous vivons une époque très excitante, qui ramène l'analyse de données et les méthodes quantitatives au coeur de la société. L'aboutissement de nombreux projets de recherche, la puissance de calcul informatique disponible et des données à profusion permettent aujourd'hui d'incroyables réalisations, grâce au travail des data scientists. Un livre de référence pour les data scientists La data science est l'art de traduire des problèmes industriels, sociaux, scientifiques, ou de toute autre nature, en problèmes de modélisation quantitative, pouvant être résolus par des algorithmes de traitement de données. Cela passe par une réflexion structurée, devant faire en sorte que se rencontrent problèmes humains, outils techniques/informatiques et méthodes statistiques/algorithmiques. Chaque projet de data science est une petite aventure, qui nécessite de partir d'un problème opérationnel souvent flou, à une réponse formelle et précise, qui aura des conséquences réelles sur le quotidien d'un nombre plus ou moins important de personnes. Éric Biernat et Michel Lutz proposent de vous guider dans cette aventure. Ils vous feront visiter les vastes espaces de la data science moderne, de plus en plus présente dans notre société et qui fait tant parler d'elle, parfois par l'intermédiaire d'un sujet qui lui est corollaire, les big data. Des études de cas pour devenir kaggle master Loin des grands discours abstraits, les auteurs vous feront découvrir, claviers à la main, les pratiques de leur métier de data scientist chez OCTO Technology, l'un des leaders français du domaine. Et vous mettrez également la main à la pâte : avec juste ce qu'il faut de théorie pour comprendre ce qu'impliquent les méthodes mathématiques utilisées, mais surtout avec votre ordinateur personnel, quelques logiciels gratuits et puissants, ainsi qu'un peu de réflexion, vous allez participer activement à cette passionnante exploration ! À qui s'adresse cet ouvrage ? Aux développeurs, statisticiens, étudiants et chefs de projets ayant à résoudre des problèmes de data science. Aux data scientists, mais aussi à toute personne curieuse d'avoir une vue d'ensemble de l'état de l'art du machine learning.","[{'type': 'ISBN_13', 'identifier': '9782212322507'}, {'type': 'ISBN_10', 'identifier': '221232250X'}]",True,True,311,BOOK,['Computers'],NOT_MATURE,True,1.16.14.0.preview.3,False,False,http://books.google.com/books/content?id=7vW4CgAAQBAJ&printsec=frontcover&img=1&zoom=5&edge=curl&source=gbs_api,http://books.google.com/books/content?id=7vW4CgAAQBAJ&printsec=frontcover&img=1&zoom=1&edge=curl&source=gbs_api,fr,http://books.google.fr/books?id=7vW4CgAAQBAJ&pg=PA2&dq=data+science&hl=&as_brr=6&cd=11&source=gbs_api,https://play.google.com/store/books/details?id=7vW4CgAAQBAJ&source=gbs_api,https://play.google.com/store/books/details?id=7vW4CgAAQBAJ,FR,FOR_SALE,True,24.99,EUR,24.99,EUR,https://play.google.com/store/books/details?id=7vW4CgAAQBAJ&rdid=book-7vW4CgAAQBAJ&rdot=1&source=gbs_api,"[{'finskyOfferType': 1, 'listPrice': {'amountInMicros': 24990000, 'currencyCode': 'EUR'}, 'retailPrice': {'amountInMicros': 24990000, 'currencyCode': 'EUR'}, 'giftable': True}]",FR,PARTIAL,True,False,ALLOWED,True,http://books.google.fr/books/download/Data_Science_fondamentaux_et_%C3%A9tudes_de-sample-epub.acsm?id=7vW4CgAAQBAJ&format=epub&output=acs4_fulfillment_token&dl_type=sample&source=gbs_api,True,http://books.google.fr/books/download/Data_Science_fondamentaux_et_%C3%A9tudes_de-sample-pdf.acsm?id=7vW4CgAAQBAJ&format=pdf&output=acs4_fulfillment_token&dl_type=sample&source=gbs_api,http://play.google.com/books/reader?id=7vW4CgAAQBAJ&hl=&as_brr=6&source=gbs_api,SAMPLE,False,"... <b>data science</b> , et ce n&#39;est d&#39;ailleurs pas pour rien que les géants du web ( Google , Yahoo , Facebook , etc. ) investissent massivement dans ce secteur . Enfin , il existe encore trop peu d&#39;ouvrages abordant la question du machine&nbsp;...",,
11,books#volume,iiEEEAAAQBAJ,xcwo8+MAK6A,https://www.googleapis.com/books/v1/volumes/iiEEEAAAQBAJ,"Data Science and Analytics (with Python, R and SPSS Programming)",,['V.K. Jain'],KHANNA PUBLISHING HOUSE,,"The Book has been written completely as per AICTE recommended syllabus on ""Data Sciences"". SALIENT FEATURES OF THE BOOK: Explains how data is collected, managed and stored for data science. With complete courseware for understand the key concepts in data science including their real-world applications and the toolkit used by data scientists. Implement data collection and management. Provided with state of the arts subjectwise. With all required tutorials on R, Python and Bokeh, Anaconda, IBM SPSS-21 and Matplotlib.","[{'type': 'ISBN_13', 'identifier': '9789386173676'}, {'type': 'ISBN_10', 'identifier': '9386173670'}]",False,True,275,BOOK,['Computers'],NOT_MATURE,True,0.1.2.0.preview.1,False,False,http://books.google.com/books/content?id=iiEEEAAAQBAJ&printsec=frontcover&img=1&zoom=5&edge=curl&source=gbs_api,http://books.google.com/books/content?id=iiEEEAAAQBAJ&printsec=frontcover&img=1&zoom=1&edge=curl&source=gbs_api,en,http://books.google.fr/books?id=iiEEEAAAQBAJ&printsec=frontcover&dq=data+science&hl=&as_brr=6&cd=12&source=gbs_api,https://play.google.com/store/books/details?id=iiEEEAAAQBAJ&source=gbs_api,https://play.google.com/store/books/details?id=iiEEEAAAQBAJ,FR,FOR_SALE,True,3.13,EUR,3.13,EUR,https://play.google.com/store/books/details?id=iiEEEAAAQBAJ&rdid=book-iiEEEAAAQBAJ&rdot=1&source=gbs_api,"[{'finskyOfferType': 1, 'listPrice': {'amountInMicros': 3130000, 'currencyCode': 'EUR'}, 'retailPrice': {'amountInMicros': 3130000, 'currencyCode': 'EUR'}, 'giftable': True}]",FR,PARTIAL,True,False,ALLOWED,False,,True,http://books.google.fr/books/download/Data_Science_and_Analytics_with_Python_R-sample-pdf.acsm?id=iiEEEAAAQBAJ&format=pdf&output=acs4_fulfillment_token&dl_type=sample&source=gbs_api,http://play.google.com/books/reader?id=iiEEEAAAQBAJ&hl=&as_brr=6&source=gbs_api,SAMPLE,False,"The Book has been written completely as per AICTE recommended syllabus on &quot;Data Sciences&quot;. SALIENT FEATURES OF THE BOOK: Explains how data is collected, managed and stored for data science.",,
